{
  "$schema": "../../../schemas/metadata.json",
  "apiVersion": 1,
  "id": "u-next",
  "name": "U-NEXT",
  "description": "That you're watching on U-NEXT, with how far along you are, or what you're browsing.",
  "version": "1.1.0",
  "authors": [
    {
      "name": "Abadima",
      "github": "Abadima"
    }
  ],
  "icon": "https://video.unext.jp/apple-touch-icon.png",
  "matches": ["https://video.unext.jp/*", "https://unext.jp/*"],
  "data": ["media", "thumbnails"],
  "settings": [
    {
      "id": "privacyMode",
      "title": "Privacy mode",
      "description": "Hide the title from your profile, and say only that you're watching or browsing.",
      "type": "boolean",
      "default": false
    },
    {
      "id": "showBrowsingStatus",
      "title": "Show browsing status",
      "description": "Show that you're browsing U-NEXT when you're not watching.",
      "type": "boolean",
      "default": true
    },
    {
      "id": "showCover",
      "title": "Show cover",
      "description": "Use the title's picture as the image on your profile, when the page has one.",
      "type": "boolean",
      "default": true,
      "when": { "privacyMode": false }
    },
    {
      "id": "showTimestamps",
      "title": "Show timestamps",
      "description": "Show when it started and when it is expected to end.",
      "type": "boolean",
      "default": true,
      "when": { "privacyMode": false }
    }
  ]
}
