{
  "$schema": "../../../schemas/metadata.json",
  "apiVersion": 1,
  "id": "netflix",
  "name": "Netflix",
  "description": "That you're watching on Netflix, with how far along you are, or what you're browsing.",
  "version": "1.1.0",
  "authors": [
    {
      "name": "Abadima",
      "github": "Abadima"
    }
  ],
  "icon": "https://assets.nflxext.com/us/ffe/siteui/common/icons/nficon2016.png",
  "matches": ["https://www.netflix.com/*"],
  "data": ["media"],
  "settings": [
    {
      "id": "privacyMode",
      "title": "Privacy mode",
      "description": "Hide the title from your profile, if the page gives one.",
      "type": "boolean",
      "default": false
    },
    {
      "id": "showTimestamps",
      "title": "Show timestamps",
      "description": "Show when it started and when it is expected to end.",
      "type": "boolean",
      "default": true,
      "when": { "privacyMode": false }
    }
  ]
}
