{
  "$schema": "../../../schemas/metadata.json",
  "apiVersion": 1,
  "id": "claude",
  "name": "Claude",
  "description": "Chatting, working in projects, and using Claude Code on claude.ai.",
  "version": "1.1.0",
  "authors": [
    {
      "name": "Abadima",
      "github": "Abadima"
    }
  ],
  "icon": "https://claude.ai/apple-touch-icon.png",
  "matches": ["https://claude.ai/*"],
  "settings": [
    {
      "id": "showChatTitle",
      "title": "Show chat titles",
      "description": "Puts a chat's title on your profile. Titles are often private.",
      "type": "boolean",
      "default": false
    }
  ]
}
