{
  "$schema": "../../../schemas/metadata.json",
  "apiVersion": 1,
  "id": "emby",
  "name": "Emby",
  "description": "What you're watching or listening to in Emby's web app (app.emby.media).",
  "version": "1.1.0",
  "authors": [
    {
      "name": "Abadima",
      "github": "Abadima"
    }
  ],
  "icon": "https://app.emby.media/images/icon-192x192.png",
  "matches": ["https://app.emby.media/*"],
  "data": ["media"],
  "settings": [
    {
      "id": "privacyMode",
      "title": "Privacy mode",
      "description": "Hide what you're watching or listening to from your profile.",
      "type": "boolean",
      "default": false
    },
    {
      "id": "showTimestamps",
      "title": "Show timestamps",
      "description": "Show when it started and when it is expected to end.",
      "type": "boolean",
      "default": true,
      "when": { "privacyMode": false }
    }
  ]
}
