{
  "$schema": "../../../schemas/metadata.json",
  "apiVersion": 1,
  "id": "the-new-york-times",
  "name": "The New York Times",
  "description": "Reading the news and playing the games on nytimes.com.",
  "version": "1.1.0",
  "authors": [
    {
      "name": "Abadima",
      "github": "Abadima"
    }
  ],
  "icon": "https://static01.nyt.com/apple-touch-icon.png",
  "matches": ["https://www.nytimes.com/*"],
  "settings": [
    {
      "id": "showHeadlines",
      "title": "Show headlines",
      "description": "Puts the article's headline on your profile.",
      "type": "boolean",
      "default": false
    }
  ]
}
