{
  "$schema": "../../../schemas/metadata.json",
  "apiVersion": 1,
  "id": "ifixit",
  "name": "iFixit",
  "description": "The repair guide, question, or device you're looking at on iFixit.",
  "version": "1.0.1",
  "authors": [
    {
      "name": "Abadima",
      "github": "Abadima"
    }
  ],
  "icon": "https://assets.cdn.ifixit.com/static/icons/ifixit/apple-touch-icon-180x180.png",
  "matches": ["https://*.ifixit.com/*"],
  "data": ["thumbnails"],
  "settings": [
    {
      "id": "privacyMode",
      "title": "Privacy mode",
      "description": "Say only what kind of page you're on, not which guide, question, or device.",
      "type": "boolean",
      "default": false
    },
    {
      "id": "showThumbnail",
      "title": "Show page image",
      "description": "Use the guide's or device's picture as the image on your profile.",
      "type": "boolean",
      "default": true,
      "when": { "privacyMode": false }
    }
  ]
}
