{
  "$schema": "../../../schemas/metadata.json",
  "apiVersion": 1,
  "id": "youtube-music",
  "name": "YouTube Music",
  "description": "The song you're listening to on YouTube Music, or what you're browsing.",
  "version": "1.1.0",
  "authors": [
    {
      "name": "Abadima",
      "github": "Abadima"
    }
  ],
  "icon": "https://music.youtube.com/img/favicon_144.png",
  "matches": ["https://music.youtube.com/*"],
  "data": ["media", "thumbnails"],
  "settings": [
    {
      "id": "privacyMode",
      "title": "Privacy mode",
      "description": "Hide the song and artist from your profile.",
      "type": "boolean",
      "default": false
    },
    {
      "id": "showCover",
      "title": "Show cover art",
      "description": "Use the song's artwork as the image on your profile.",
      "type": "boolean",
      "default": true
    },
    {
      "id": "showTimestamps",
      "title": "Show timestamps",
      "description": "Show when the song started and when it is expected to end.",
      "type": "boolean",
      "default": true
    }
  ]
}
