{
  "$schema": "../../../schemas/metadata.json",
  "apiVersion": 1,
  "id": "hbo-max",
  "name": "HBO Max",
  "description": "That you're watching on HBO Max, with how far along you are, or what you're browsing.",
  "version": "1.1.0",
  "authors": [
    {
      "name": "Abadima",
      "github": "Abadima"
    }
  ],
  "icon": "https://www.hbomax.com/apple-touch-icon.png",
  "matches": ["https://play.hbomax.com/*", "https://www.hbomax.com/*"],
  "data": ["media", "thumbnails"],
  "settings": [
    {
      "id": "privacyMode",
      "title": "Privacy mode",
      "description": "Hide the title from your profile, if the page gives one.",
      "type": "boolean",
      "default": false
    },
    {
      "id": "showTimestamps",
      "title": "Show timestamps",
      "description": "Show when it started and when it is expected to end.",
      "type": "boolean",
      "default": true,
      "when": { "privacyMode": false }
    },
    {
      "id": "showThumbnail",
      "title": "Show title image",
      "description": "Use the title's picture as the image on your profile, when the page has one.",
      "type": "boolean",
      "default": true,
      "when": { "privacyMode": false }
    }
  ]
}
