{
  "$schema": "../../../schemas/metadata.json",
  "apiVersion": 1,
  "id": "parousia",
  "name": "Parousia",
  "description": "Reading the documentation and downloading Parousia on its website.",
  "version": "1.0.2",
  "authors": [
    {
      "name": "Abadima",
      "github": "Abadima"
    }
  ],
  "icon": "https://parousia.abadima.dev/pwa/icons/icon-512.png",
  "matches": ["https://parousia.abadima.dev/*"]
}
