{
  "$schema": "../../../schemas/metadata.json",
  "apiVersion": 1,
  "id": "google-play",
  "name": "Google Play",
  "description": "The apps, movies, and books you look at on the Google Play Store.",
  "version": "1.0.0",
  "authors": [
    {
      "name": "Abadima",
      "github": "Abadima"
    }
  ],
  "icon": "https://play.google.com/favicon.ico",
  "matches": ["https://play.google.com/*"]
}
