{
  "$schema": "../../../schemas/metadata.json",
  "apiVersion": 1,
  "id": "riix-fun",
  "name": "riix's Slayers 2 Wiki",
  "description": "Browsing guides, gear, Breathing Styles, Blood Demon Arts, and more on riix.fun.",
  "version": "1.0.0",
  "authors": [
    {
      "name": "riix",
      "github": "riixly"
    }
  ],
  "icon": "https://riix.fun/favicon-180.png",
  "matches": ["https://riix.fun/*"]
}
