{
  "$schema": "../../../schemas/metadata.json",
  "apiVersion": 1,
  "id": "abadima",
  "name": "Abadima's Portfolio",
  "description": "The blog post or project you're looking at on Abadima's portfolio, or what you're browsing.",
  "version": "1.1.0",
  "authors": [
    {
      "name": "Abadima",
      "github": "Abadima"
    }
  ],
  "icon": "https://abadima.dev/assets/imgs/abadima_fav.ico",
  "matches": ["https://abadima.dev/*"],
  "settings": [
    {
      "id": "privacyMode",
      "title": "Privacy mode",
      "description": "Show which part of the site you're in, not which post or project.",
      "type": "boolean",
      "default": false
    }
  ]
}
