{
  "$schema": "../../../schemas/metadata.json",
  "apiVersion": 1,
  "id": "stoat",
  "name": "Stoat",
  "description": "The kind of conversation you're in on Stoat, or what you're browsing.",
  "version": "1.0.0",
  "authors": [
    {
      "name": "Abadima",
      "github": "Abadima"
    }
  ],
  "icon": "https://stoat.chat/app/assets/web/android-chrome-512x512.png",
  "matches": ["https://stoat.chat/*"]
}
